{
  "$schema": "./graph.schema.json",
  "meta": {
    "title_zh": "国内 vs 国外 AI 版图竞争关系图",
    "title_en": "China vs Global AI Competition Map",
    "version": "v2.11.0",
    "updated": "2026-08-10"
  },
  "views": {
    "invest": [
      "cn-cloud",
      "global-cloud",
      "deepseek",
      "glm",
      "qwen",
      "seed-model",
      "hunyuan-model",
      "ernie-model",
      "moonshot-model",
      "baichuan",
      "minimax-model",
      "zeroone-ai",
      "openai",
      "gemini",
      "anthropic",
      "openclaw",
      "tongyi-lingma",
      "marscode-trae",
      "baidu-comate",
      "amazon-q-developer",
      "jetbrains-ai-assistant",
      "windsurf",
      "cursor",
      "copilot",
      "codex",
      "claude-code"
    ],
    "procure": [
      "cn-cloud",
      "global-cloud",
      "deepseek",
      "glm",
      "qwen",
      "seed-model",
      "hunyuan-model",
      "ernie-model",
      "moonshot-model",
      "baichuan",
      "minimax-model",
      "zeroone-ai",
      "openai",
      "anthropic",
      "openclaw",
      "tongyi-lingma",
      "marscode-trae",
      "baidu-comate",
      "amazon-q-developer",
      "jetbrains-ai-assistant",
      "windsurf",
      "copilot",
      "cursor",
      "codex",
      "claude-code",
      "cn-channel",
      "global-channel"
    ]
  },
  "nodes": [
    {
      "id": "cn-cloud",
      "column": "domestic",
      "lane": "upstream",
      "region": "domestic",
      "type": "upstream",
      "name_zh": "国内云与算力",
      "name_en": "China Cloud & Compute",
      "role_zh": "推理托管、企业私有化、成本优化",
      "role_en": "Inference hosting, private deployment, and cost optimization",
      "representative_models": ["阿里云", "腾讯云", "华为云", "火山引擎"]
    },
    {
      "id": "cn-channel",
      "column": "domestic",
      "lane": "upstream",
      "region": "domestic",
      "type": "upstream",
      "name_zh": "流量与分发入口",
      "name_en": "Distribution Channels",
      "role_zh": "超级 App、办公入口、终端生态",
      "role_en": "Super apps, office entry points, and device ecosystems",
      "representative_models": ["抖音/今日头条", "微信/QQ", "百度搜索", "小米/华为终端"]
    },
    {
      "id": "deepseek",
      "column": "domestic",
      "lane": "model",
      "region": "domestic",
      "type": "model",
      "name_zh": "DeepSeek",
      "name_en": "DeepSeek",
      "role_zh": "开源权重、高性价比推理与 Agent 编码能力",
      "role_en": "Open weights, cost-efficient inference, and agentic coding",
      "representative_models": ["DeepSeek-V4-Pro", "DeepSeek-V4-Flash", "DeepSeek-V3.2"]
    },
    {
      "id": "glm",
      "column": "domestic",
      "lane": "model",
      "region": "domestic",
      "type": "model",
      "name_zh": "GLM",
      "name_en": "GLM",
      "role_zh": "中文能力与企业落地能力",
      "role_en": "Strong Chinese capability and enterprise deployment fit",
      "representative_models": ["GLM-5", "GLM-4.7", "GLM-4.6"]
    },
    {
      "id": "qwen",
      "column": "domestic",
      "lane": "model",
      "region": "domestic",
      "type": "model",
      "name_zh": "Qwen",
      "name_en": "Qwen",
      "role_zh": "开源生态完整，覆盖通用、多模态、代码与 Agent 工作流",
      "role_en": "Broad open ecosystem across general, multimodal, coding, and agent workflows",
      "representative_models": ["Qwen3.7-Max", "Qwen3.7-Plus", "Qwen3-Coder"]
    },
    {
      "id": "seed-model",
      "column": "domestic",
      "lane": "model",
      "region": "domestic",
      "type": "model",
      "name_zh": "Seed",
      "name_en": "Seed",
      "role_zh": "字节跳动通用与多模态模型底座，强化复杂任务与 Agent 生产部署",
      "role_en": "ByteDance foundation models for multimodal, complex-task, and production agent workloads",
      "representative_models": ["Seed 2.0", "Seed 1.8", "Seeduplex"]
    },
    {
      "id": "hunyuan-model",
      "column": "domestic",
      "lane": "model",
      "region": "domestic",
      "type": "model",
      "name_zh": "腾讯混元",
      "name_en": "Tencent Hunyuan",
      "role_zh": "腾讯统一基础模型与 AI PaaS 底座，服务内部应用和腾讯云",
      "role_en": "Tencent's unified foundation-model and AI PaaS layer for internal apps and cloud",
      "representative_models": ["HY3 Preview", "Hunyuan Vision 1.5", "Hunyuan 3D"]
    },
    {
      "id": "ernie-model",
      "column": "domestic",
      "lane": "model",
      "region": "domestic",
      "type": "model",
      "name_zh": "文心 ERNIE",
      "name_en": "ERNIE",
      "role_zh": "百度原生全模态与知识增强模型，连接搜索、千帆和企业应用",
      "role_en": "Baidu native multimodal and knowledge-enhanced models linked to Search and Qianfan",
      "representative_models": ["ERNIE 5.1", "ERNIE 5.0", "ERNIE X1.1"]
    },
    {
      "id": "moonshot-model",
      "column": "domestic",
      "lane": "model",
      "region": "domestic",
      "type": "model",
      "name_zh": "Moonshot",
      "name_en": "Moonshot",
      "role_zh": "长上下文与检索增强能力突出",
      "role_en": "Strong long-context reasoning and retrieval-augmented capabilities",
      "representative_models": ["Kimi K2.6", "Kimi K2.5", "Kimi K2"]
    },
    {
      "id": "baichuan",
      "column": "domestic",
      "lane": "model",
      "region": "domestic",
      "type": "model",
      "name_zh": "Baichuan",
      "name_en": "Baichuan",
      "role_zh": "企业知识与行业应用导向明显",
      "role_en": "Strong enterprise knowledge and industry-oriented model capabilities",
      "representative_models": ["Baichuan4", "Baichuan2-Turbo", "Baichuan2-192k"]
    },
    {
      "id": "minimax-model",
      "column": "domestic",
      "lane": "model",
      "region": "domestic",
      "type": "model",
      "name_zh": "MiniMax",
      "name_en": "MiniMax",
      "role_zh": "多模态与语音交互能力突出",
      "role_en": "Strong multimodal and voice-interaction model capabilities",
      "representative_models": ["MiniMax M2.7", "MiniMax M2.5", "MiniMax Speech 2.6"]
    },
    {
      "id": "zeroone-ai",
      "column": "domestic",
      "lane": "model",
      "region": "domestic",
      "type": "model",
      "name_zh": "01.AI",
      "name_en": "01.AI",
      "role_zh": "开源与高性能推理路线并重",
      "role_en": "Balanced strategy across open-source models and high-performance inference",
      "representative_models": ["Yi-Large", "Yi-Lightning", "Yi-34B-Chat"]
    },
    {
      "id": "doubao",
      "column": "domestic",
      "lane": "app",
      "region": "domestic",
      "type": "app",
      "name_zh": "豆包",
      "name_en": "Doubao",
      "role_zh": "消费级助手、生态分发能力强；短视频/资讯入口协同；多模态交互；Agent 化任务执行",
      "role_en": "Consumer assistant with strong ecosystem distribution, multimodal interaction, and task-agent execution",
      "app_subcategory": "customer-chat",
      "representative_models": ["Seed 2.0", "Seed 1.8", "Seeduplex"]
    },
    {
      "id": "kimi",
      "column": "domestic",
      "lane": "app",
      "region": "domestic",
      "type": "app",
      "name_zh": "Kimi",
      "name_en": "Kimi",
      "role_zh": "长文本、检索问答、知识组织；网页/PDF 深度阅读；证据链引用；研究任务模式",
      "role_en": "Long-context search QA and knowledge organization with deep document reading, citations, and research mode",
      "app_subcategory": "search-answer",
      "representative_models": ["Kimi K2.6", "Kimi K2.5", "Kimi K2"]
    },
    {
      "id": "tongyi-lingma",
      "column": "domestic",
      "lane": "app",
      "region": "domestic",
      "type": "app",
      "name_zh": "通义灵码",
      "name_en": "Tongyi Lingma",
      "role_zh": "面向企业研发和云原生场景的 AI 编码助手",
      "role_en": "AI coding assistant for enterprise development and cloud-native workflows",
      "app_subcategory": "coding-developer",
      "representative_models": ["Qwen3-Coder", "Qwen3.7-Plus", "Qwen3.6-Plus"]
    },
    {
      "id": "marscode-trae",
      "column": "domestic",
      "lane": "app",
      "region": "domestic",
      "type": "app",
      "name_zh": "Trae / MarsCode",
      "name_en": "Trae / MarsCode",
      "role_zh": "强调开发体验与协同效率的 AI Coding 助手",
      "role_en": "AI coding assistant focused on developer experience and team collaboration",
      "app_subcategory": "coding-developer",
      "representative_models": ["Seed 2.0", "Seed 1.8", "DeepSeek-V4"]
    },
    {
      "id": "baidu-comate",
      "column": "domestic",
      "lane": "app",
      "region": "domestic",
      "type": "app",
      "name_zh": "百度 Comate",
      "name_en": "Baidu Comate",
      "role_zh": "面向企业研发与 IDE 场景的智能编码助手",
      "role_en": "AI coding assistant for enterprise development and IDE workflows",
      "app_subcategory": "coding-developer",
      "representative_models": ["Comate", "ERNIE Code", "Baidu DevOps"]
    },
    {
      "id": "global-cloud",
      "column": "global",
      "lane": "upstream",
      "region": "global",
      "type": "upstream",
      "name_zh": "全球云与算力",
      "name_en": "Global Cloud & Compute",
      "role_zh": "大规模训练与全球推理服务",
      "role_en": "Large-scale training and global inference services",
      "representative_models": ["AWS", "Google Cloud", "Microsoft Azure", "Oracle Cloud"]
    },
    {
      "id": "global-channel",
      "column": "global",
      "lane": "upstream",
      "region": "global",
      "type": "upstream",
      "name_zh": "产品分发入口",
      "name_en": "Product Distribution Entrypoints",
      "role_zh": "搜索、办公套件、开发工具生态",
      "role_en": "Search, office suites, and developer ecosystems",
      "representative_models": ["Google Search", "Microsoft 365", "Apple App Store", "Chrome/Edge"]
    },
    {
      "id": "openai",
      "column": "global",
      "lane": "model",
      "region": "global",
      "type": "model",
      "name_zh": "OpenAI",
      "name_en": "OpenAI",
      "role_zh": "通用模型 + API + 应用协同",
      "role_en": "General model + API + application synergy",
      "representative_models": ["GPT-5.6 Sol", "GPT-5.6 Terra", "GPT-5.6 Luna"]
    },
    {
      "id": "gemini",
      "column": "global",
      "lane": "model",
      "region": "global",
      "type": "model",
      "name_zh": "Gemini",
      "name_en": "Gemini",
      "role_zh": "多模态 + 谷歌生态联动",